{
  "schemaVersion": "1.0.0",
  "skillVersion": "0.2.7",
  "credentialScope": "workspace_local",
  "authenticationMode": "local_webform",
  "credentials": {
    "usernameRef": "expedia.username",
    "passwordRef": "expedia.password",
    "usernameConfigured": true,
    "passwordConfigured": true
  },
  "properties": [
    {
      "id": "TEST-100",
      "name": "Example Hotel",
      "timezone": "America/Los_Angeles"
    }
  ]
}
